{
  "id": "11111111-1111-1111-1111-111111111111",
  "process_id": "22222222-2222-2222-2222-222222222222",
  "normalization_run_id": "33333333-3333-3333-3333-333333333333",
  "stable_key": "aaaaaaaaaaaaaaaaaaaaaaaaaaaaaaaaaaaaaaaaaaaaaaaaaaaaaaaaaaaaaaaa",
  "category": "FINANCIAL",
  "scope": "HABILITATING",
  "modality": "MANDATORY",
  "description": "El proponente debe acreditar indice de liquidez minimo de 1.2.",
  "condition_text": null,
  "expected_value": {
    "value": 1.2,
    "unit": null,
    "raw_text": "1.2"
  },
  "criticality": "UNKNOWN",
  "criticality_basis": "UNKNOWN",
  "subsanability": "UNKNOWN",
  "subsanability_basis": "UNKNOWN",
  "confidence": 0.86,
  "evidence_status": "VALIDATED",
  "review_status": "PENDING",
  "requires_human_review": true,
  "is_active": true,
  "created_at": "2026-07-02T00:00:00Z",
  "updated_at": "2026-07-02T00:00:00Z"
}
